date,workout_id,location,duration_min,days_since_last_workout,recovered_1_5,mood_1_5,notes
2026-01-20,hit_lower_a,home,12,3,4,4,felt recovered; went hard
2026-01-23,hit_fullbody_a,home,16.50,2,3,3,tried full body with measuring times. All ok. + DZIK
2026-01-27,hit_fullbody_a,home,17.1,3,3,2,bit tired due to nose inflamantion; intensive training byt few breaks in between were longer
2026-01-30,hit_fullbody_a,home,17.22,3,2,3,good mood but difficult to start
2026-02-07,hit_fullbody_a,home,16.02,8,5,4,felt recovered (1 week vacation); went ok but lack on legs. Lower TUT times - looks like I was not recovered
2026-02-10,hit_fullbody_a,home,16.42,3,4,4,felt reovered but legs hurt a bit before workout
2026-02-13,hit_fullbody_a,home,16.42,3,4,3,Tried with online stopwatch
2026-02-17,hit_fullbody_a,home,16.2,4,4,4,"Drink coffee, a lot of water and 2 bonbons"